A1: Фактические расходы по группам | D1: Повторный проект
A2: Доставка | B2: 426.74671751475211 | D2: Доставка | E2: 426.74671751475211
A3: Инструмент | B3: 223.86978093211533 | D3: Инструмент | E3: 223.86978093211533
A4: Каркас | B4: 2058.0334726558922 | D4: Материалы | E4: 3901
A5: Коммуникации | B5: 149.06713780918727 | D5: Работа | E5: 2990
A6: Крыша | B6: 546.66736929738693 | D6: Связь | E6: 165.05510744144158
A7: Маркетинг | B7: 103.42432090375755 | D7: Транспорт | E7: 187.42653414891268
A8: Монтаж | B8: 1160.292810401339 | E8: =SUM(E2:E7) -> 7894.098140037222
A9: Организационные | B9: 1830.1572439344657
A10: Пол | B10: 235.84095263968217
A11: Связь | B11: 165.05510744144158
A12: Снос | B12: 551.16639873954273
A13: Стены | B13: 605.52041215630027
A14: Транспорт | B14: 187.42653414891268
A15: Фундамент | B15: 455.03270460519803
A16: Чертежи | B16: 489.05826415840943
B17: =SUM(B2:B16) -> 9187.3592273383838
A21: Месяц | B21: Число | C21: Курс | D21: Расход | E21: Цена в $ | F21: Группа | G21: Цель
A22: 5 | B22: 7 | C22: 14250 | D22: 100000 | E22: =D22/C22 -> 7.0175438596491224 | F22: Маркетинг | G22: Логотип
A23: 5 | B23: 8 | C23: 14260 | D23: 100000 | E23: =D23/C23 -> 7.0126227208976157 | F23: Связь | G23: Мобильный
A24: 5 | B24: 8 | C24: 14260 | D24: 100000 | E24: =D24/C24 -> 7.0126227208976157 | F24: Транспорт | G24: Экскурсии
A25: 5 | B25: 8 | C25: 14260 | D25: 200000 | E25: =D25/C25 -> 14.025245441795231 | F25: Маркетинг | G25: Экскурсии
A26: 5 | B26: 9 | C26: 14280 | D26: 200000 | E26: =D26/C26 -> 14.005602240896359 | F26: Маркетинг | G26: Экскурсии
A27: 5 | B27: 10 | C27: 14280 | D27: 200000 | E27: =D27/C27 -> 14.005602240896359 | F27: Маркетинг | G27: Экскурсии
A28: 5 | B28: 13 | C28: 14280 | D28: 100000 | E28: =D28/C28 -> 7.0028011204481793 | F28: Транспорт | G28: Экскурсии
A29: 5 | B29: 15 | C29: 14150 | D29: 5600000 | E29: =D29/C29 -> 395.75971731448766 | F29: Организационные | G29: Содержание
A30: 5 | B30: 17 | C30: 14150 | D30: 200000 | E30: =D30/C30 -> 14.134275618374557 | F30: Связь | G30: Мобильный
A31: 5 | B31: 18 | C31: 14150 | D31: 200000 | E31: =D31/C31 -> 14.134275618374557 | F31: Транспорт | G31: Экскурсии
A32: 5 | B32: 18 | C32: 14150 | D32: 800000 | E32: =D32/C32 -> 56.53710247349823 | F32: Чертежи | G32: Solid
A33: 5 | B33: 19 | C33: 14150 | D33: 200000 | E33: =D33/C33 -> 14.134275618374557 | F33: Транспорт | G33: Экскурсии
A34: 5 | B34: 19 | C34: 14150 | D34: 200000 | E34: =D34/C34 -> 14.134275618374557 | F34: Маркетинг | G34: Экскурсии
A35: 5 | B35: 20 | C35: 14150 | D35: 100000 | E35: =D35/C35 -> 7.0671378091872787 | F35: Связь | G35: Мобильный
A36: 5 | B36: 20 | C36: 14150 | D36: 2109300 | E36: =D36/C36 -> 149.06713780918727 | F36: Коммуникации | G36: Установка электричества
A37: 5 | B37: 23 | C37: 14320 | D37: 200000 | E37: =D37/C37 -> 13.966480446927374 | F37: Связь | G37: Мобильный
A38: 5 | B38: 23 | C38: 14320 | D38: 50000 | E38: =D38/C38 -> 3.4916201117318435 | F38: Транспорт | G38: Минск-Ялча
A39: 5 | B39: 24 | C39: 14320 | D39: 50000 | E39: =D39/C39 -> 3.4916201117318435 | F39: Транспорт | G39: Ялча-Минск
A40: 5 | B40: 25 | C40: 14320 | D40: 2000000 | E40: =D40/C40 -> 139.66480446927375 | F40: Снос | G40: Разборка сруба_часть1
A41: 5 | B41: 26 | C41: 14410 | D41: 300000 | E41: =D41/C41 -> 20.818875780707842 | F41: Снос | G41: Разборка сруба_часть2
A42: 5 | B42: 26 | C42: 14410 | D42: 4000000 | E42: =D42/C42 -> 277.58501040943787 | F42: Снос | G42: Вывоз мусора
A43: 5 | B43: 28 | C43: 14630 | D43: 1020000 | E43: =D43/C43 -> 69.719753930280248 | F43: Чертежи | G43: Архитектура_часть1
A44: 5 | B44: 29 | C44: 14810 | D44: 1020000 | E44: =D44/C44 -> 68.872383524645514 | F44: Чертежи | G44: Архитектура_часть2
A45: 5 | B45: 29 | C45: 14810 | D45: 500000 | E45: =D45/C45 -> 33.7609723160027 | F45: Снос | G45: Разборка сруба_часть3
A46: 6 | B46: 1 | C46: 14890 | D46: 250000 | E46: =D46/C46 -> 16.789791806581597 | F46: Связь | G46: Мобильный
A47: 6 | B47: 2 | C47: 14815 | D47: 120000 | E47: =D47/C47 -> 8.0998987512656093 | F47: Связь | G47: Интернет
A48: 6 | B48: 3 | C48: 14912 | D48: 100000 | E48: =D48/C48 -> 6.7060085836909868 | F48: Снос | G48: Разборка сруба_часть4
A49: 6 | B49: 3 | C49: 14912 | D49: 50000 | E49: =D49/C49 -> 3.3530042918454934 | F49: Транспорт | G49: Минск-Ялча
A50: 6 | B50: 3 | C50: 14912 | D50: 500000 | E50: =D50/C50 -> 33.530042918454939 | F50: Снос | G50: Разборка сруба_часть5
A51: 6 | B51: 3 | C51: 14912 | D51: 600000 | E51: =D51/C51 -> 40.236051502145919 | F51: Маркетинг | G51: Визитки
A52: 6 | B52: 8 | C52: 15316 | D52: 100000 | E52: =D52/C52 -> 6.529119874640898 | F52: Инструмент | G52: деталь для бензопилы
A53: 6 | B53: 10 | C53: 15488 | D53: 100000 | E53: =D53/C53 -> 6.4566115702479339 | F53: Транспорт | G53: Ялча-Минск
A54: 6 | B54: 12 | C54: 15345 | D54: 700000 | E54: =D54/C54 -> 45.617464972303679 | F54: Чертежи | G54: Конструкция часть1
A55: 6 | B55: 13 | C55: 15345 | D55: 600000 | E55: =D55/C55 -> 39.100684261974585 | F55: Снос | G55: Разборка сруба_часть6
A56: 6 | B56: 15 | C56: 15345 | D56: 21300 | E56: =D56/C56 -> 1.3880742913000979 | F56: Транспорт | G56: Ялча-Минск
A57: 6 | B57: 15 | C57: 15345 | D57: 25000 | E57: =D57/C57 -> 1.6291951775822744 | F57: Транспорт | G57: Минск-Ялча
A58: 6 | B58: 15 | C58: 15345 | D58: 5600000 | E58: =D58/C58 -> 364.93971977842943 | F58: Организационные | G58: Содержание
A59: 6 | B59: 15 | C59: 15345 | D59: 55200 | E59: =D59/C59 -> 3.5972629521016617 | F59: Инструмент | G59: Замок для гаража
A60: 6 | B60: 22 | C60: 15293 | D60: 195800 | E60: =D60/C60 -> 12.80324331393448 | F60: Транспорт | G60: Проездной
A61: 6 | B61: 26 | C61: 15380 | D61: 1014000 | E61: =D61/C61 -> 65.929778933680097 | F61: Фундамент | G61: Цемент
A62: 6 | B62: 26 | C62: 15380 | D62: 27000 | E62: =D62/C62 -> 1.7555266579973992 | F62: Фундамент | G62: Арматура
A63: 6 | B63: 26 | C63: 15380 | D63: 535700 | E63: =D63/C63 -> 34.830949284785433 | F63: Фундамент | G63: Руберойд
A64: 6 | B64: 26 | C64: 15380 | D64: 600000 | E64: =D64/C64 -> 39.011703511053319 | F64: Доставка | G64: Материалы на фундамент
A65: 6 | B65: 26 | C65: 15380 | D65: 919000 | E65: =D65/C65 -> 59.752925877763332 | F65: Фундамент | G65: Арматура
A66: 6 | B66: 28 | C66: 15308 | D66: 120000 | E66: =D66/C66 -> 7.8390384112882154 | F66: Связь | G66: Интернет
A67: 6 | B67: 28 | C67: 15308 | D67: 23850 | E67: =D67/C67 -> 1.5580088842435329 | F67: Транспорт | G67: Минск-Ялча
A68: 6 | B68: 29 | C68: 15308 | D68: 23950 | E68: =D68/C68 -> 1.5645414162529396 | F68: Транспорт | G68: Ялча-Минск
A69: 7 | B69: 1 | C69: 15333 | D69: 119200 | E69: =D69/C69 -> 7.7740820452618538 | F69: Фундамент | G69: Лента скотч
A70: 7 | B70: 1 | C70: 15333 | D70: 220000 | E70: =D70/C70 -> 14.348138003000065 | F70: Связь | G70: Мобильный
A71: 7 | B71: 1 | C71: 15333 | D71: 24000 | E71: =D71/C71 -> 1.565251418509098 | F71: Транспорт | G71: Минск-Ялча
A72: 7 | B72: 1 | C72: 15333 | D72: 58000 | E72: =D72/C72 -> 3.7826909280636536 | F72: Фундамент | G72: Арматура
A73: 7 | B73: 1 | C73: 15333 | D73: 62000 | E73: =D73/C73 -> 4.0435661644818364 | F73: Фундамент | G73: Вязальная проволока
A74: 7 | B74: 2 | C74: 15333 | D74: 23900 | E74: =D74/C74 -> 1.5587295375986434 | F74: Транспорт | G74: Ялча-Минск
A75: 7 | B75: 13 | C75: 15391 | D75: 23800 | E75: =D75/C75 -> 1.5463582613215516 | F75: Транспорт | G75: Минск-Ялча
A76: 7 | B76: 14 | C76: 15237 | D76: 27000 | E76: =D76/C76 -> 1.7720023626698169 | F76: Транспорт | G76: Ялча-Минск
A77: 7 | B77: 15 | C77: 15330 | D77: 5600000 | E77: =D77/C77 -> 365.29680365296804 | F77: Организационные | G77: Содержание
A78: 7 | B78: 20 | C78: 15182 | D78: 1550000 | E78: =D78/C78 -> 102.09458569358451 | F78: Каркас | G78: коннекторы_часть1
A79: 7 | B79: 21 | C79: 15182 | D79: 26100 | E79: =D79/C79 -> 1.719141088130681 | F79: Транспорт | G79: Минск-Ялча
A80: 7 | B80: 21 | C80: 15182 | D80: 26100 | E80: =D80/C80 -> 1.719141088130681 | F80: Транспорт | G80: Ялча-Минск
A81: 7 | B81: 21 | C81: 15182 | D81: 300000 | E81: =D81/C81 -> 19.760242392306679 | F81: Каркас | G81: Заклепки для коннекторов
A82: 7 | B82: 22 | C82: 15200 | D82: 160200 | E82: =D82/C82 -> 10.539473684210526 | F82: Транспорт | G82: Проездной
A83: 7 | B83: 29 | C83: 15200 | D83: 70000 | E83: =D83/C83 -> 4.6052631578947372 | F83: Связь | G83: Интернет
A84: 8 | B84: 1 | C84: 15248 | D84: 23800 | E84: =D84/C84 -> 1.5608604407135362 | F84: Транспорт | G84: Минск-Ялча
A85: 8 | B85: 1 | C85: 15248 | D85: 500000 | E85: =D85/C85 -> 32.791185729275973 | F85: Фундамент | G85: Разметка фундамента
A86: 8 | B86: 2 | C86: 15248 | D86: 1000000 | E86: =D86/C86 -> 65.582371458551947 | F86: Фундамент | G86: Песок 2 машины
A87: 8 | B87: 2 | C87: 15248 | D87: 30000 | E87: =D87/C87 -> 1.9674711437565582 | F87: Транспорт | G87: Ялча-Минск
A88: 8 | B88: 3 | C88: 15248 | D88: 300000 | E88: =D88/C88 -> 19.674711437565584 | F88: Доставка | G88: Коннекторы и материалы на фундамент
A89: 8 | B89: 3 | C89: 15248 | D89: 620000 | E89: =D89/C89 -> 40.661070304302207 | F89: Инструмент | G89: Аренда инструмента
A90: 8 | B90: 5 | C90: 15497 | D90: 200000 | E90: =D90/C90 -> 12.905723688455829 | F90: Доставка | G90: Бензин
A91: 8 | B91: 11 | C91: 15805 | D91: 195800 | E91: =D91/C91 -> 12.388484656754192 | F91: Транспорт | G91: Проездной
A92: 8 | B92: 11 | C92: 15805 | D92: 3900000 | E92: =D92/C92 -> 246.75735526732046 | F92: Каркас | G92: Коннекторы
A93: 8 | B93: 12 | C93: 15805 | D93: 1550000 | E93: =D93/C93 -> 98.070230939576078 | F93: Чертежи | G93: конструктив часть2
A94: 8 | B94: 12 | C94: 15805 | D94: 128000 | E94: =D94/C94 -> 8.0987029421069288 | F94: Инструмент | G94: Сверло для свай
A95: 8 | B95: 12 | C95: 15805 | D95: 2500000 | E95: =D95/C95 -> 158.17779183802594 | F95: Фундамент | G95: Бурение и заливка свай
A96: 8 | B96: 12 | C96: 15805 | D96: 300000 | E96: =D96/C96 -> 18.981335020563112 | F96: Фундамент | G96: Анкера 20 штук
A97: 8 | B97: 17 | C97: 15991 | D97: 100000 | E97: =D97/C97 -> 6.2535176036520541 | F97: Связь | G97: Интернет
A98: 8 | B98: 17 | C98: 15991 | D98: 200000 | E98: =D98/C98 -> 12.507035207304108 | F98: Связь | G98: Мобильный
A99: 8 | B99: 18 | C99: 15991 | D99: 30000 | E99: =D99/C99 -> 1.8760552810956164 | F99: Транспорт | G99: Минск-Ялча
A100: 8 | B100: 18 | C100: 15991 | D100: 30000 | E100: =D100/C100 -> 1.8760552810956164 | F100: Транспорт | G100: Ялча-Минск
A101: 8 | B101: 21 | C101: 16498 | D101: 1768000 | E101: =D101/C101 -> 107.16450478845921 | F101: Каркас | G101: Крепление для бруса + инструмент
A102: 8 | B102: 21 | C102: 16498 | D102: 2720000 | E102: =D102/C102 -> 164.86846890532186 | F102: Каркас | G102: Изготовление креплений и пластин
A103: 8 | B103: 21 | C103: 16498 | D103: 26900 | E103: =D103/C103 -> 1.6305006667474846 | F103: Фундамент | G103: хомут стальной
A104: 8 | B104: 21 | C104: 16498 | D104: 300000 | E104: =D104/C104 -> 18.184022305734029 | F104: Доставка | G104: Бензин
A105: 8 | B105: 21 | C105: 16498 | D105: 768400 | E105: =D105/C105 -> 46.575342465753423 | F105: Каркас | G105: Шурупы шестигранные+пропитка
A106: 8 | B106: 22 | C106: 16730 | D106: 23900 | E106: =D106/C106 -> 1.4285714285714286 | F106: Транспорт | G106: Ялча-Минск
A107: 8 | B107: 24 | C107: 16730 | D107: 195800 | E107: =D107/C107 -> 11.703526598924089 | F107: Транспорт | G107: Проездной
A108: 8 | B108: 25 | C108: 16730 | D108: 1150000 | E108: =D108/C108 -> 68.738792588164969 | F108: Доставка | G108: и разгрузка бруса
A109: 8 | B109: 25 | C109: 16730 | D109: 6720000 | E109: =D109/C109 -> 401.673640167364 | F109: Каркас | G109: Брус 3 куба
A110: 8 | B110: 26 | C110: 17836 | D110: 1300000 | E110: =D110/C110 -> 72.886297376093296 | F110: Чертежи | G110: каркас первая часть
A111: 8 | B111: 28 | C111: 17667 | D111: 30000 | E111: =D111/C111 -> 1.6980811682798438 | F111: Транспорт | G111: Минск-Ялча
A112: 8 | B112: 29 | C112: 17539 | D112: 400000 | E112: =D112/C112 -> 22.806317349905925 | F112: Каркас | G112: Распиловка бруса
A113: 8 | B113: 30 | C113: 17539 | D113: 30000 | E113: =D113/C113 -> 1.7104738012429443 | F113: Транспорт | G113: Ялча-Минск
A114: 9 | B114: 1 | C114: 17452 | D114: 1350000 | E114: =D114/C114 -> 77.355030942012377 | F114: Чертежи | G114: Каркас вторая часть
A115: 9 | B115: 2 | C115: 17399 | D115: 18800 | E115: =D115/C115 -> 1.0805218690729352 | F115: Инструмент | G115: Насадка
A116: 9 | B116: 2 | C116: 17399 | D116: 2162200 | E116: =D116/C116 -> 124.27150985688833 | F116: Каркас | G116: Шурупы+болты
A117: 9 | B117: 2 | C117: 17399 | D117: 250000 | E117: =D117/C117 -> 14.368641875969884 | F117: Связь | G117: Мобильный
A118: 9 | B118: 2 | C118: 17399 | D118: 276500 | E118: =D118/C118 -> 15.89171791482269 | F118: Каркас | G118: Шурупы
A119: 9 | B119: 2 | C119: 17399 | D119: 509700 | E119: =D119/C119 -> 29.294787056727397 | F119: Каркас | G119: Крепления+шурупы
A120: 9 | B120: 3 | C120: 17399 | D120: 111000 | E120: =D120/C120 -> 6.3796769929306283 | F120: Доставка | G120: Бензин
A121: 9 | B121: 3 | C121: 17399 | D121: 200000 | E121: =D121/C121 -> 11.494913500775906 | F121: Инструмент | G121: Аренда бензопилы
A122: 9 | B122: 5 | C122: 17683 | D122: 1400000 | E122: =D122/C122 -> 79.172086184470956 | F122: Каркас | G122: Монтаж бруса и балок
A123: 9 | B123: 8 | C123: 17791 | D123: 172100 | E123: =D123/C123 -> 9.6734303861503008 | F123: Инструмент | G123: Цепь для пилы
A124: 9 | B124: 8 | C124: 17791 | D124: 195800 | E124: =D124/C124 -> 11.005564611320331 | F124: Транспорт | G124: Проездной
A125: 9 | B125: 8 | C125: 17791 | D125: 265000 | E125: =D125/C125 -> 14.895171716036199 | F125: Инструмент | G125: Сверло и трещетка
A126: 9 | B126: 8 | C126: 17791 | D126: 386800 | E126: =D126/C126 -> 21.741329885897365 | F126: Инструмент | G126: Патрон
A127: 9 | B127: 8 | C127: 17791 | D127: 400000 | E127: =D127/C127 -> 22.48327806194143 | F127: Доставка | G127: Доска 150мм на распиловку
A128: 9 | B128: 8 | C128: 17791 | D128: 6331000 | E128: =D128/C128 -> 355.85408352537797 | F128: Каркас | G128: Доска 150мм
A129: 9 | B129: 8 | C129: 17791 | D129: 90200 | E129: =D129/C129 -> 5.0699792029677928 | F129: Каркас | G129: Шурупы
A130: 9 | B130: 8 | C130: 17791 | D130: 906700 | E130: =D130/C130 -> 50.963970546905742 | F130: Каркас | G130: Шурупы и крепления
A131: 9 | B131: 10 | C131: 17807 | D131: 1050000 | E131: =D131/C131 -> 58.965575335542205 | F131: Доставка | G131: Доска 150мм в Ялчу
A132: 9 | B132: 10 | C132: 17807 | D132: 185000 | E132: =D132/C132 -> 10.389172797214579 | F132: Крыша | G132: Фанера ОСБ
A133: 9 | B133: 10 | C133: 17807 | D133: 2100000 | E133: =D133/C133 -> 117.93115067108441 | F133: Каркас | G133: Распиловка доски 150мм
A134: 9 | B134: 12 | C134: 17807 | D134: 12000 | E134: =D134/C134 -> 0.67389228954905378 | F134: Транспорт | G134: Ялча-Минск
A135: 9 | B135: 15 | C135: 17798 | D135: 2200000 | E135: =D135/C135 -> 123.60939431396787 | F135: Каркас | G135: Брусок 50мм
A136: 9 | B136: 15 | C136: 17798 | D136: 350000 | E136: =D136/C136 -> 19.665130913585795 | F136: Доставка | G136: Плита ОСБ и Брусок на распиловку_
A137: 9 | B137: 15 | C137: 17798 | D137: 4584000 | E137: =D137/C137 -> 257.55702887964941 | F137: Крыша | G137: Плита ОСБ
A138: 9 | B138: 16 | C138: 17798 | D138: 170000 | E138: =D138/C138 -> 9.5516350151702447 | F138: Связь | G138: Мобильный
A139: 9 | B139: 17 | C139: 17720 | D139: 27000 | E139: =D139/C139 -> 1.5237020316027088 | F139: Транспорт | G139: Минск-Ялча
A140: 9 | B140: 17 | C140: 17720 | D140: 85000 | E140: =D140/C140 -> 4.7968397291196387 | F140: Каркас | G140: Саморезы на 100мм
A141: 9 | B141: 18 | C141: 17720 | D141: 800000 | E141: =D141/C141 -> 45.146726862302486 | F141: Каркас | G141: Сборка каркаса стен
A142: 9 | B142: 20 | C142: 17531 | D142: 3946000 | E142: =D142/C142 -> 225.0869887627631 | F142: Каркас | G142: Крепления и пленка
A143: 9 | B143: 21 | C143: 17531 | D143: 1050000 | E143: =D143/C143 -> 59.893902230334838 | F143: Доставка | G143: Треугольники и бруски в Ялчу
A144: 9 | B144: 21 | C144: 17531 | D144: 150000 | E144: =D144/C144 -> 8.5562717471906904 | F144: Доставка | G144: Леса высотой 5м
A145: 9 | B145: 21 | C145: 17531 | D145: 1600000 | E145: =D145/C145 -> 91.266898636700702 | F145: Каркас | G145: Сборка купола первая часть
A146: 9 | B146: 21 | C146: 17531 | D146: 2250000 | E146: =D146/C146 -> 128.34407620786035 | F146: Каркас | G146: Распиловка треугольников и брусков
A147: 9 | B147: 25 | C147: 17672 | D147: 30000 | E147: =D147/C147 -> 1.6976007243096423 | F147: Транспорт | G147: Ялча_Минск
A148: 9 | B148: 25 | C148: 17672 | D148: 6300000 | E148: =D148/C148 -> 356.49615210502492 | F148: Организационные | G148: Содержание за август
A149: 9 | B149: 26 | C149: 17672 | D149: 600000 | E149: =D149/C149 -> 33.952014486192844 | F149: Инструмент | G149: Прокат лесов высотой 5м на 2 недели
A150: 9 | B150: 28 | C150: 17707 | D150: 23800 | E150: =D150/C150 -> 1.3441012029141017 | F150: Транспорт | G150: Минск-Ялча
A151: 10 | B151: 1 | C151: 17688 | D151: 1400000 | E151: =D151/C151 -> 79.14970601537766 | F151: Каркас | G151: Сборка купола вторая часть
A152: 10 | B152: 2 | C152: 17673 | D152: 1200000 | E152: =D152/C152 -> 67.900186725513493 | F152: Крыша | G152: Монтаж мембраны+бруски+треугольники_1 часть купола_
A153: 10 | B153: 2 | C153: 17673 | D153: 200000 | E153: =D153/C153 -> 11.316697787585582 | F153: Доставка | G153: Леса в Ягодку
A154: 10 | B154: 2 | C154: 17673 | D154: 200000 | E154: =D154/C154 -> 11.316697787585582 | F154: Связь | G154: Мобильный
A155: 10 | B155: 2 | C155: 17673 | D155: 50000 | E155: =D155/C155 -> 2.8291744468963955 | F155: Транспорт | G155: Минск_Ялча попутка
A156: 10 | B156: 3 | C156: 17673 | D156: 200000 | E156: =D156/C156 -> 11.316697787585582 | F156: Транспорт | G156: Просмотр крыши из жидкой резины
A157: 10 | B157: 4 | C157: 17723 | D157: 195800 | E157: =D157/C157 -> 11.047791006037352 | F157: Транспорт | G157: Проездной
A158: 10 | B158: 4 | C158: 17723 | D158: 731800 | E158: =D158/C158 -> 41.290977825424591 | F158: Крыша | G158: Шурупы и гвозди
A159: 10 | B159: 5 | C159: 17723 | D159: 607900 | E159: =D159/C159 -> 34.300062066241608 | F159: Каркас | G159: Шурупы и пропитка
A160: 10 | B160: 6 | C160: 17740 | D160: 1000000 | E160: =D160/C160 -> 56.369785794813978 | F160: Доставка | G160: Имитация+фанера+подкладочный ковер
A161: 10 | B161: 6 | C161: 17740 | D161: 2400000 | E161: =D161/C161 -> 135.28748590755356 | F161: Крыша | G161: Подкладочный ковер
A162: 10 | B162: 6 | C162: 17740 | D162: 3166500 | E162: =D162/C162 -> 178.49492671927845 | F162: Пол | G162: Фанера и мембрана
A163: 10 | B163: 6 | C163: 17740 | D163: 4972000 | E163: =D163/C163 -> 280.27057497181511 | F163: Стены | G163: Имитация бруса
A164: 10 | B164: 8 | C164: 17413 | D164: 500000 | E164: =D164/C164 -> 28.714179061620626 | F164: Инструмент | G164: Прокат шуруповерта 4 недели
A165: 10 | B165: 10 | C165: 17202 | D165: 2800000 | E165: =D165/C165 -> 162.77177072433437 | F165: Крыша | G165: Монтаж мембраны+бруски+треугольники_2 часть купола
A166: 10 | B166: 11 | C166: 17202 | D166: 30000 | E166: =D166/C166 -> 1.7439832577607255 | F166: Транспорт | G166: Ялча-Минск
A167: 10 | B167: 12 | C167: 17202 | D167: 718100 | E167: =D167/C167 -> 41.745145913265901 | F167: Крыша | G167: Гвозди+шурупы+инструмент
A168: 10 | B168: 13 | C168: 17162 | D168: 28300 | E168: =D168/C168 -> 1.64899195897914 | F168: Транспорт | G168: Минск-Ялча
A169: 10 | B169: 14 | C169: 17343 | D169: 1500000 | E169: =D169/C169 -> 86.490226604393698 | F169: Крыша | G169: Монтаж подкладочного ковра первая часть
A170: 10 | B170: 16 | C170: 17248 | D170: 800000 | E170: =D170/C170 -> 46.382189239332099 | F170: Крыша | G170: Установка и изготовление верхушки
A171: 10 | B171: 17 | C171: 17194 | D171: 1800000 | E171: =D171/C171 -> 104.68768174944748 | F171: Крыша | G171: Монтаж подкладочного ковра вторая часть
A172: 10 | B172: 18 | C172: 17194 | D172: 30000 | E172: =D172/C172 -> 1.7447946958241247 | F172: Транспорт | G172: Ялча-Минск
A173: 10 | B173: 22 | C173: 17252 | D173: 1038000 | E173: =D173/C173 -> 60.16693716670531 | F173: Стены | G173: Пропитка
A174: 10 | B174: 22 | C174: 17252 | D174: 23800 | E174: =D174/C174 -> 1.3795501970785995 | F174: Транспорт | G174: Минск-Ялча
A175: 10 | B175: 25 | C175: 17258 | D175: 2000000 | E175: =D175/C175 -> 115.88828369451848 | F175: Стены | G175: Обшивка стен часть 1
A176: 10 | B176: 27 | C176: 17258 | D176: 30000 | E176: =D176/C176 -> 1.7383242554177774 | F176: Транспорт | G176: Ялча-Минск
A177: 10 | B177: 27 | C177: 17258 | D177: 6000000 | E177: =D177/C177 -> 347.66485108355545 | F177: Организационные | G177: Содержание за сентябрь
A178: 10 | B178: 28 | C178: 17358 | D178: 455800 | E178: =D178/C178 -> 26.258785574374929 | F178: Инструмент | G178: Пилки и биты
A179: 10 | B179: 29 | C179: 17469 | D179: 100000 | E179: =D179/C179 -> 5.7244261262808402 | F179: Инструмент | G179: Прокат электрорубанка
A180: 10 | B180: 29 | C180: 17469 | D180: 1625400 | E180: =D180/C180 -> 93.044822256568779 | F180: Стены | G180: входная дверь
A181: 10 | B181: 29 | C181: 17469 | D181: 200000 | E181: =D181/C181 -> 11.44885225256168 | F181: Инструмент | G181: Прокат шуруповерта 2 недели
A182: 10 | B182: 29 | C182: 17469 | D182: 23800 | E182: =D182/C182 -> 1.36241341805484 | F182: Транспорт | G182: Минск-Ялча
A183: 10 | B183: 29 | C183: 17469 | D183: 525200 | E183: =D183/C183 -> 30.064686015226975 | F183: Стены | G183: Дверь_врезка петель и замка
A184: 10 | B184: 31 | C184: 17438 | D184: 2500000 | E184: =D184/C184 -> 143.36506480100928 | F184: Стены | G184: Обшивка стен часть 2
A185: 11 | B185: 1 | C185: 17438 | D185: 1000000 | E185: =D185/C185 -> 57.346025920403719 | F185: Пол | G185: Настил чернового пола
A186: 11 | B186: 1 | C186: 17438 | D186: 129000 | E186: =D186/C186 -> 7.3976373437320797 | F186: Доставка | G186: аренда прицепа
A187: 11 | B187: 1 | C187: 17438 | D187: 244400 | E187: =D187/C187 -> 14.015368734946668 | F187: крыша | G187: жесть для отливов
A188: 11 | B188: 1 | C188: 17438 | D188: 300000 | E188: =D188/C188 -> 17.203807776121113 | F188: Доставка | G188: бензин
A189: 11 | B189: 1 | C189: 17438 | D189: 500000 | E189: =D189/C189 -> 28.673012960201859 | F189: Стены | G189: Нанесение пропитки в два слоя
A190: 11 | B190: 2 | C190: 17438 | D190: 30000 | E190: =D190/C190 -> 1.7203807776121114 | F190: Транспорт | G190: Ялча-Минск
A191: 11 | B191: 2 | C191: 17438 | D191: 500000 | E191: =D191/C191 -> 28.673012960201859 | F191: Стены | G191: Установка двери
A192: 11 | B192: 4 | C192: 17447 | D192: 300000 | E192: =D192/C192 -> 17.194933226342638 | F192: Связь | G192: Мобильный
E193: =SUM(E22:E192) -> 9187.3592273383802